[
  {
    "id": "template-001",
    "clientId": "client-001",
    "name": "Document Request",
    "nameRu": "Запрос документа",
    "nameUk": "Запит документа",
    "description": "Standard template for client document requests",
    "descriptionRu": "Стандартный шаблон для запросов документов от клиентов",
    "defaultType": "request",
    "defaultPriority": "medium",
    "defaultSlaPolicyId": "sla-001",
    "defaultRoutingRole": "rm",
    "defaultClientVisible": true,
    "titleTemplate": "Запрос документа: {document_type}",
    "descriptionTemplate": "Клиент запрашивает: {document_type}\nПериод: {period}\nДополнительные требования: {notes}",
    "fieldsJson": "[{\"name\":\"document_type\",\"type\":\"select\",\"required\":true,\"options\":[\"Выписка по портфелю\",\"Налоговые документы\",\"Отчет о доходности\",\"Другое\"]},{\"name\":\"period\",\"type\":\"text\",\"required\":true},{\"name\":\"notes\",\"type\":\"textarea\",\"required\":false}]",
    "tagsJson": "[\"document\",\"client-request\"]",
    "isActive": true,
    "usageCount": 45,
    "category": "Client Requests",
    "createdAt": "2025-01-15T10:00:00Z",
    "updatedAt": "2026-01-20T14:00:00Z"
  },
  {
    "id": "template-002",
    "clientId": "client-001",
    "name": "Reconciliation Issue",
    "nameRu": "Ошибка сверки банка",
    "nameUk": "Помилка звірки банку",
    "description": "Template for reporting reconciliation discrepancies",
    "descriptionRu": "Шаблон для фиксации расхождений при сверке",
    "defaultType": "incident",
    "defaultPriority": "high",
    "defaultSlaPolicyId": "sla-002",
    "defaultRoutingRole": "data_ops",
    "defaultClientVisible": false,
    "titleTemplate": "Расхождение сверки: {custodian} - {account}",
    "descriptionTemplate": "Custodian: {custodian}\nAccount: {account}\nРасхождение: {amount} {currency}\nДата обнаружения: {date}",
    "fieldsJson": "[{\"name\":\"custodian\",\"type\":\"text\",\"required\":true},{\"name\":\"account\",\"type\":\"text\",\"required\":true},{\"name\":\"amount\",\"type\":\"number\",\"required\":true},{\"name\":\"currency\",\"type\":\"text\",\"required\":true},{\"name\":\"date\",\"type\":\"date\",\"required\":true}]",
    "tagsJson": "[\"reconciliation\",\"data-quality\"]",
    "isActive": true,
    "usageCount": 23,
    "category": "Data Operations",
    "createdAt": "2025-02-01T10:00:00Z",
    "updatedAt": "2026-01-15T09:00:00Z"
  },
  {
    "id": "template-003",
    "clientId": "client-001",
    "name": "IPS Change Request",
    "nameRu": "Изменение IPS",
    "nameUk": "Зміна IPS",
    "description": "Template for Investment Policy Statement changes",
    "descriptionRu": "Шаблон для запросов на изменение инвестиционной политики",
    "defaultType": "change",
    "defaultPriority": "medium",
    "defaultSlaPolicyId": "sla-003",
    "defaultRoutingRole": "compliance",
    "defaultClientVisible": true,
    "titleTemplate": "Изменение IPS: {change_type}",
    "descriptionTemplate": "Тип изменения: {change_type}\nОписание: {description}\nОбоснование: {rationale}",
    "fieldsJson": "[{\"name\":\"change_type\",\"type\":\"select\",\"required\":true,\"options\":[\"Ограничения\",\"Бенчмарк\",\"Риск-профиль\",\"ESG фильтры\",\"Другое\"]},{\"name\":\"description\",\"type\":\"textarea\",\"required\":true},{\"name\":\"rationale\",\"type\":\"textarea\",\"required\":true}]",
    "tagsJson": "[\"ips\",\"compliance\",\"change\"]",
    "isActive": true,
    "usageCount": 12,
    "category": "Compliance",
    "createdAt": "2025-03-01T10:00:00Z",
    "updatedAt": "2026-01-10T11:00:00Z"
  },
  {
    "id": "template-004",
    "clientId": "client-001",
    "name": "Billing Dispute",
    "nameRu": "Проблема оплаты счета",
    "nameUk": "Проблема оплати рахунку",
    "description": "Template for fee and billing inquiries",
    "descriptionRu": "Шаблон для вопросов по комиссиям и счетам",
    "defaultType": "request",
    "defaultPriority": "high",
    "defaultSlaPolicyId": "sla-005",
    "defaultRoutingRole": "finance",
    "defaultClientVisible": true,
    "titleTemplate": "Вопрос по счету: {invoice_id}",
    "descriptionTemplate": "Номер счета: {invoice_id}\nПериод: {period}\nСумма расхождения: {discrepancy_amount}\nОписание проблемы: {description}",
    "fieldsJson": "[{\"name\":\"invoice_id\",\"type\":\"text\",\"required\":true},{\"name\":\"period\",\"type\":\"text\",\"required\":true},{\"name\":\"discrepancy_amount\",\"type\":\"number\",\"required\":false},{\"name\":\"description\",\"type\":\"textarea\",\"required\":true}]",
    "tagsJson": "[\"billing\",\"finance\",\"dispute\"]",
    "isActive": true,
    "usageCount": 8,
    "category": "Finance",
    "createdAt": "2025-04-01T10:00:00Z",
    "updatedAt": "2025-12-20T15:00:00Z"
  },
  {
    "id": "template-005",
    "clientId": "client-001",
    "name": "Sync Failure Incident",
    "nameRu": "Сбой синхронизации",
    "nameUk": "Збій синхронізації",
    "description": "Auto-created for data sync failures",
    "descriptionRu": "Автоматически создается при сбоях синхронизации данных",
    "defaultType": "incident",
    "defaultPriority": "high",
    "defaultSlaPolicyId": "sla-002",
    "defaultRoutingRole": "data_ops",
    "defaultClientVisible": false,
    "titleTemplate": "Сбой синхронизации: {connector_name}",
    "descriptionTemplate": "Коннектор: {connector_name}\nСтатус: {error_code}\nСообщение: {error_message}\nПоследняя успешная синхронизация: {last_success}",
    "fieldsJson": "[{\"name\":\"connector_name\",\"type\":\"text\",\"required\":true},{\"name\":\"error_code\",\"type\":\"text\",\"required\":true},{\"name\":\"error_message\",\"type\":\"text\",\"required\":true},{\"name\":\"last_success\",\"type\":\"datetime\",\"required\":false}]",
    "tagsJson": "[\"sync\",\"integration\",\"auto-created\"]",
    "isActive": true,
    "usageCount": 67,
    "category": "Data Operations",
    "createdAt": "2025-01-20T10:00:00Z",
    "updatedAt": "2026-02-01T08:00:00Z"
  },
  {
    "id": "template-006",
    "clientId": "client-001",
    "name": "Trust Beneficiary Change",
    "nameRu": "Изменение бенефициаров траста",
    "nameUk": "Зміна бенефіціарів трасту",
    "description": "Template for trust beneficiary modifications",
    "descriptionRu": "Шаблон для изменений бенефициаров траста",
    "defaultType": "change",
    "defaultPriority": "medium",
    "defaultSlaPolicyId": "sla-003",
    "defaultRoutingRole": "compliance",
    "defaultScopeType": "entity",
    "defaultClientVisible": true,
    "titleTemplate": "Изменение бенефициаров: {trust_name}",
    "descriptionTemplate": "Траст: {trust_name}\nТип изменения: {change_type}\nБенефициар: {beneficiary_name}\nДокументы приложены: {docs_attached}",
    "fieldsJson": "[{\"name\":\"trust_name\",\"type\":\"text\",\"required\":true},{\"name\":\"change_type\",\"type\":\"select\",\"required\":true,\"options\":[\"Добавление\",\"Удаление\",\"Изменение доли\"]},{\"name\":\"beneficiary_name\",\"type\":\"text\",\"required\":true},{\"name\":\"docs_attached\",\"type\":\"boolean\",\"required\":true}]",
    "tagsJson": "[\"trust\",\"beneficiary\",\"compliance\"]",
    "isActive": true,
    "usageCount": 5,
    "category": "Trust Administration",
    "createdAt": "2025-05-01T10:00:00Z",
    "updatedAt": "2025-11-15T12:00:00Z"
  },
  {
    "id": "template-007",
    "clientId": "client-001",
    "name": "Tax Document Request",
    "nameRu": "Запрос налоговых документов",
    "nameUk": "Запит податкових документів",
    "description": "Template for tax-related document requests",
    "descriptionRu": "Шаблон для запросов налоговых документов",
    "defaultType": "request",
    "defaultPriority": "high",
    "defaultSlaPolicyId": "sla-001",
    "defaultRoutingRole": "rm",
    "defaultClientVisible": true,
    "titleTemplate": "Налоговые документы: {tax_year}",
    "descriptionTemplate": "Налоговый год: {tax_year}\nТребуемые документы: {doc_types}\nНалоговый советник: {advisor_name}\nСрок подачи: {deadline}",
    "fieldsJson": "[{\"name\":\"tax_year\",\"type\":\"number\",\"required\":true},{\"name\":\"doc_types\",\"type\":\"multiselect\",\"required\":true,\"options\":[\"Tax Lots\",\"Realized Gains\",\"Dividend Income\",\"Interest Income\",\"K-1 Forms\"]},{\"name\":\"advisor_name\",\"type\":\"text\",\"required\":false},{\"name\":\"deadline\",\"type\":\"date\",\"required\":false}]",
    "tagsJson": "[\"tax\",\"documents\",\"annual\"]",
    "isActive": true,
    "usageCount": 34,
    "category": "Client Requests",
    "createdAt": "2025-01-10T10:00:00Z",
    "updatedAt": "2026-01-05T09:00:00Z"
  },
  {
    "id": "template-008",
    "clientId": "client-001",
    "name": "Data Quality Exception",
    "nameRu": "Исключение Data Quality",
    "nameUk": "Виняток Data Quality",
    "description": "Auto-created for DQ exceptions",
    "descriptionRu": "Автоматически создается при обнаружении проблем с качеством данных",
    "defaultType": "incident",
    "defaultPriority": "medium",
    "defaultSlaPolicyId": "sla-002",
    "defaultRoutingRole": "data_ops",
    "defaultClientVisible": false,
    "titleTemplate": "DQ Exception: {rule_name}",
    "descriptionTemplate": "Правило: {rule_name}\nСерьезность: {severity}\nЗатронутые записи: {affected_count}\nОписание: {description}",
    "fieldsJson": "[{\"name\":\"rule_name\",\"type\":\"text\",\"required\":true},{\"name\":\"severity\",\"type\":\"select\",\"required\":true,\"options\":[\"critical\",\"high\",\"medium\",\"low\"]},{\"name\":\"affected_count\",\"type\":\"number\",\"required\":true},{\"name\":\"description\",\"type\":\"textarea\",\"required\":true}]",
    "tagsJson": "[\"dq\",\"data-quality\",\"auto-created\"]",
    "isActive": true,
    "usageCount": 89,
    "category": "Data Operations",
    "createdAt": "2025-02-15T10:00:00Z",
    "updatedAt": "2026-02-02T07:00:00Z"
  },
  {
    "id": "template-009",
    "clientId": "client-001",
    "name": "Performance Inquiry",
    "nameRu": "Вопрос по доходности",
    "nameUk": "Питання щодо дохідності",